{
  "$schema": "https://json-schema.org/draft/2020-12/schema",
  "$id": "https://github.com/Dorusto/yt-pipeline/schemas/director_plan.schema.json",
  "title": "director_plan",
  "description": "The director's plan for one edit: one idea, a structure with the reason it was chosen, and the shots, each with its purpose, its technique and the moment wanted. The code editor executes it without changing shots and answers with a short report; the director may then answer with notes (max 2 rounds). Written by the director (an OpenRouter model, or the host agent in agent mode), read by the editor and shown in plain words in the Director tab.",
  "type": "object",
  "required": ["schema_version", "generated_at", "brief", "content_type", "idea", "structure", "shots"],
  "additionalProperties": false,
  "$defs": {
    "shot_ref": {
      "type": "string",
      "minLength": 3,
      "description": "shot key from shotlog.json: <clip counter>/<segment id>, e.g. 0081/s7, or <photo>/p1 for a photo"
    }
  },
  "properties": {
    "schema_version": {"type": "string", "minLength": 1},
    "generated_at": {"type": "string", "description": "ISO 8601 timestamp of the plan"},
    "tool": {"type": "string"},
    "brief": {
      "type": "object",
      "required": ["text"],
      "additionalProperties": false,
      "properties": {
        "text": {"type": "string"},
        "target_duration_s": {"type": ["number", "null"], "exclusiveMinimum": 0},
        "order": {"type": ["string", "null"], "enum": ["chronological", "score", null]},
        "pacing": {"type": ["string", "null"], "enum": ["calm-to-energy", "uniform", null]},
        "ambient_only": {"type": ["boolean", "null"]}
      }
    },
    "content_type": {
      "type": "string",
      "enum": ["vacation", "tutorial", "presentation", "talking-head"]
    },
    "idea": {
      "type": "string",
      "minLength": 1,
      "description": "one sentence: what this edit is about and what the viewer should feel"
    },
    "structure": {
      "type": "object",
      "required": ["kind", "why", "beats"],
      "additionalProperties": false,
      "properties": {
        "kind": {
          "type": "string",
          "enum": ["chronological", "strongest_first", "frame", "journey", "music_cut", "other"],
          "description": "the structure chosen from the menu in prompts/director.md"
        },
        "why": {
          "type": "string",
          "minLength": 1,
          "description": "why this structure fits this subject and message, in plain words"
        },
        "beats": {
          "type": "array",
          "minItems": 1,
          "description": "the story beats in order; the sum of target_s should be the target duration",
          "items": {
            "type": "object",
            "required": ["id", "name", "intent", "target_s"],
            "additionalProperties": false,
            "properties": {
              "id": {"type": "string", "minLength": 1},
              "name": {"type": "string", "minLength": 1},
              "intent": {"type": "string", "minLength": 1, "description": "what this beat does for the story"},
              "target_s": {"type": "number", "exclusiveMinimum": 0}
            }
          }
        }
      }
    },
    "shots": {
      "type": "array",
      "minItems": 1,
      "description": "the shots in timeline order",
      "items": {
        "type": "object",
        "required": ["id", "beat", "shot_key", "purpose", "technique", "target_s", "why"],
        "additionalProperties": false,
        "properties": {
          "id": {"type": "string", "minLength": 1, "description": "slot id: v1, v2, ... in timeline order"},
          "beat": {"type": "string", "minLength": 1, "description": "the structure.beats[].id this shot serves"},
          "shot_key": {"$ref": "#/$defs/shot_ref"},
          "purpose": {
            "type": "string",
            "minLength": 1,
            "description": "what this shot does in the story (its job), in plain words"
          },
          "technique": {
            "type": "string",
            "enum": [
              "none", "opening_shot", "clean_entry", "clean_exit", "cut_on_motion",
              "jerky_approach", "time_compression", "slow_fast", "kuleshov"
            ],
            "description": "the technique from the catalogue in prompts/director.md; none when the shot is just a plain cut"
          },
          "pieces": {
            "type": "integer",
            "minimum": 2,
            "maximum": 5,
            "description": "jerky_approach and time_compression only: how many short pieces of the take"
          },
          "moment": {
            "type": "object",
            "additionalProperties": false,
            "anyOf": [{"required": ["at_s"]}, {"required": ["hint"]}],
            "description": "the moment the cut should be built around; the editor keeps the good part of the shot around it",
            "properties": {
              "at_s": {"type": "number", "minimum": 0, "description": "seconds inside the source clip"},
              "hint": {"type": "string", "minLength": 1, "description": "the moment in words, when the director has no timecode, e.g. 'the boat passes the gate'"}
            }
          },
          "target_s": {
            "type": "number",
            "exclusiveMinimum": 0,
            "description": "how long the shot should be on screen; a guide: the editor cuts on a beat and keeps it inside the shot length limits (config director.shot_limits) unless over_limit_reason is given"
          },
          "over_limit_reason": {
            "type": "string",
            "minLength": 1,
            "description": "optional; one plain sentence saying why this shot may run longer than the shot length limit; the editor then keeps the asked length, still on a beat"
          },
          "why": {
            "type": "string",
            "minLength": 1,
            "description": "why this shot, here, in plain words (shown in the Director tab)"
          }
        }
      }
    },
    "notes": {
      "type": "array",
      "items": {"type": "string"},
      "description": "anything the editor should know, and the owner's notes the plan follows"
    },
    "meta": {
      "type": "object",
      "required": ["tool", "wall_time_s", "llm_cost_usd"],
      "additionalProperties": false,
      "properties": {
        "tool": {"type": "string"},
        "wall_time_s": {"type": "number", "minimum": 0},
        "llm_cost_usd": {"type": "number", "minimum": 0}
      }
    }
  }
}
